Code_x,Description,Code_y
QQY,"San Marcos, TX: San Marcos Regional",14435
QRD,"Redondo Beach, CA: Redondo Beach Airport",14438
QRO,"Queretaro, Mexico: Queretaro International",14440
QRO,"Queretaro, Mexico: Queretaro International",16477
QSO,"Southbridge, MA: Southbridge Municipal",14441
QSR,"Salerno, Italy: Salerno Airport",16768
QTB,"Tubarao, Brazil: Tubarao Airport",16492
RAB,"Rabaul, Papua New Guinea: Tokua",14446
RAC,"Racine, WI: Batten International",14447
RAD,"Tortola, British Virgin Islands: Roadtown Seaplane Base",14448
RAE,"Arar, Saudi Arabia: Arar Airport",14449
RAH,"Rafha, Saudi Arabia: Rafha Airport",14450
RAI,"Praia, Cape Verde: Praia International",14451
RAJ,"Rajkot, India: Rajkot Airport",14452
RAK,"Marrakech, Morocco: Menara",14453
RAL,"Riverside, CA: Riverside Municipal",14454
RAN,"Ravenna, Italy: Ravenna Airport",14455
RAO,"Ribeirao Preto, Brazil: Leite Lopes",14456
RAP,"Rapid City, SD: Rapid City Regional",14457
RAR,"Avarua, Cook Islands: Rarotonga International",14458
RAS,"Rasht, Iran: Sardar E Jangal",14459
RAT,"Raduzhnyi, Russia: Raduzhnyi Airport",14460
RAX,"Red Bank, NJ: Greely Helipad",14461
RAZ,"Rawala Kot, Pakistan: Rawalakot",14462
RBA,"Rabat, Morocco: Rabat/Sale International",14463
RBB,"Ugashik, AK: Randy Field",14464
RBD,"Dallas/Fort Worth, TX: Dallas Executive",14465
RBF,"Big Bear City, CA: Big Bear City Airport",14466
RBG,"Roseburg, OR: Roseburg Regional",14467
RBH,"Brooks Lodge, AK: Brooks Lodge Airport",14468
RBL,"Red Bluff, CA: Red Bluff Municipal",14469
RBN,"Fort Jefferson, FL: Fort Jefferson Airport",14470
RBO,"Robore, Bolivia: Robore Airport",14471
RBR,"Rio Branco, Brazil: Placido de Castro International",14472
RBW,"Walterboro, SC: Lowcountry Regional",16542
RBY,"Ruby, AK: Ruby Airport",14474
RCA,"Rapid City, SD: Ellsworth AFB",14475
RCB,"Richards Bay, South Africa: Richards Bay Airport",14476
RCE,"Roche Harbor, WA: Roche Harbor Airport",14477
RCH,"Riohacha, Colombia: Almirante Padilla",14478
RCM,"Richmond, Australia: Richmond Airport",14479
RCO,"Rochefort, France: Rochefort Charente Maritime",14480
RCQ,"Reconquista, Argentina: Reconquista Airport",14481
RCT,"Reed City, MI: Miller Field",14482
RCU,"Rio Curato, Argentina: Rio Cuarto",14483
RDA,"Rockhampton Downs, Australia: Rockhampton Downs Airport",14484
RDB,"Red Dog, AK: Red Dog Airport",14485
RDC,"Redencao, Brazil: Redencao Airport",14486
RDD,"Redding, CA: Redding Regional",14487
RDG,"Reading, PA: Reading Regional/Carl A Spaatz Field",14488
RDM,"Bend/Redmond, OR: Roberts Field",14489
RDR,"Red River, ND: Grand Forks AFB",14490
RDT,"Richard-Toll, Senegal: Richard-Toll Airport",14491
RDU,"Raleigh/Durham, NC: Raleigh-Durham International",14492
RDV,"Red Devil, AK: Red Devil Airport",14493
RDZ,"Rodez, France: Rodez Aveyron",14494
REB,"Redlands, CA: Redlands Municipal",14495
REC,"Recife, Brazil: Guararapes Gilberto Freyre International",14496
RED,"Reedsville, PA: Mifflin County",14497
REE,"Lubbock, TX: Reese AFB",14498
REG,"Reggio Calabria, Italy: Reggio Calabria Airport",14499
REH,"Rehoboth, DE: Rehoboth Aircrafters",14500
REK,"Reykjavik, Iceland: Reykjavik Metropolitan Area",14501
REL,"Trelew, Argentina: Almirante Zar",14502
REN,"Orenburg, Russia: Orenburg Airport",14504
REP,"Siem Reap, Cambodia: Siem Reap International",14505
RER,"Retalhuleu, Guatemala: Retalhuleu Airport",14506
RES,"Resistencia, Argentina: Resistencia Airport",14507
RET,"Rost, Norway: Rost Airport",14508
REU,"Reus, Spain: Reus Airport",14509
REX,"Reynosa, Mexico: Reynosa International",14510
REY,"Reyes, Bolivia: Reyes Airport",14511
RFD,"Rockford, IL: Chicago/Rockford International",14512
RFP,"Raiatea, French Polynesia: Raiatea Uturoa",14513
RGA,"Rio Grande, Argentina: Rio Grande Airport",14514
RGI,"Tuamoto Islands, French Polynesia: Rangiroa",14515
RGL,"Rio Gallegos, Argentina: Rio Gallegos Airport",14516
RGN,"Yangon, Burma: Yangon International",14517
RGT,"Rengat, Indonesia: Japura",14518
RHD,"Rio Hondo, Argentina: Termas de Rio Hondo",16798
RHE,"Reims, France: Champagne",14519
RHI,"Rhinelander, WI: Rhinelander/Oneida County",14520
RHO,"Rhodes, Greece: Diagoras",14521
RIA,"Santa Maria, Brazil: Santa Maria Airport",14522
RIB,"Riberalta, Bolivia: Cap Av Selin Zeitun Lopez",14523
RIC,"Richmond, VA: Richmond International",14524
RID,"Richmond, IN: Richmond Municipal",14525
RIE,"Rice Lake, WI: Rice Lake Airport",14526
RIF,"Richfield, UT: Richfield Municipal",14527
RIG,"Rio Grande, Brazil: Regional de Rio Grande",14528
RIJ,"Rioja, Peru: Rioja Airport",14529
RIL,"Rifle, CO: Rifle Garfield County",14530
RIO,"Rio de Janeiro, Brazil: Rio de Janeiro Metropolitan Area",14531
RIR,"Riverside, CA: Flabob",14532
RIV,"Riverside, CA: March ARB",14533
RIW,"Riverton/Lander, WY: Central Wyoming Regional",14534
RIX,"Riga, Latvia: Riga International",14535
RIY,"Riyan Mukalla, Yemen: Mukalla International",14536
RJK,"Rijeka, Croatia: Rijeka Airport",14537
RJL,"Logrono, Spain: Logrono Airport",14538
RKD,"Rockland, ME: Knox County Regional",14539
RKE,"Copenhagen, Denmark: Roskilde",14540
RKH,"Rock Hill, SC: Rock Hill/York County/Bryant Field",10836
RKP,"Rockport, TX: Aransas County",14541
RKR,"Poteau, OK: Robert S Kerr",14542
RKS,"Rock Springs, WY: Southwest Wyoming Regional",14543
RKT,"Ras Al Khaimah, United Arab Emirates: Ras Al Khaimah International",14544
RKV,"Reykjavik, Iceland: Reykjavik Airport",14545
RKW,"Rockwood, TN: Rockwood Municipal",14546
RLA,"Rolla, MO: Rolla Downtown",14547
RLD,"Richland, WA: Richland Airport",14548
RLG,"Rostock-Laage, Germany: Laage",14549
RLT,"Arlit, Niger: Arlit Airport",14550
RLU,"Bornite/Ruby Creek, AK: Bornite Upper",14551
RMA,"Roma, Australia: Roma Airport",14552
RME,"Rome, NY: Griffiss International",14553
RMF,"Marsa Alam, Egypt: Marsa Alam International",16564
RMG,"Rome, GA: Richard B Russell Regional J H Towers Field",14554
RMI,"Rimini, Italy: Rimini Miramare",14555
RML,"Colombo, Sri Lanka: Colombo International Ratmalana",14556
RMN,"Stafford, VA: Stafford Regional",14557
RMP,"Rampart, AK: Rampart Airport",14559
RMQ,"Taichung, Taiwan: Taichung Ching Chuan Kang",14560
RMS,"Ramstein, Germany: Ramstein AB",14561
RMT,"Rimatara, French Polynesia: Rimatara Airport",14562
RMU,"Murcia, Spain: Murcia Airport",16921
RNB,"Ronneby, Sweden: Ronneby Airport",14563
RNC,"McMinnville, TN: Warren County Memorial",14564
RND,"San Antonio, TX: Randolph AFB",14565
RNE,"Roanne, France: Roanne Airport",14566
RNG,"Rangely, CO: Rangely Airport",14567
RNH,"New Richmond, WI: New Richmond Regional",16771
RNI,"Corn Island, Nicaragua: Corn Island Airport",14568
RNM,"Ramona, CA: Ramona Airport",16787
RNN,"Ronne, Denmark: Bornholm Ronne",14569
RNO,"Reno, NV: Reno/Tahoe International",14570
RNS,"Rennes, France: Rennes Saint Jacques",14571
RNT,"Renton, WA: Renton Municipal",14572
RNU,"Ranau, Malaysia: Ranau Airport",14573
RO1,"Campia Turzii, Romania: Campia Turzii Airport",16685
ROA,"Roanoke, VA: Roanoke Blacksburg Regional",14574
ROB,"Monrovia, Liberia: Monrovia Roberts International",14575
ROC,"Rochester, NY: Frederick Douglass Grtr Rochester International",14576
ROG,"Rogers, AR: Rogers Executive Carter Field",14577
ROK,"Rockhampton, Australia: Rockhampton Airport",14578
ROL,"Roosevelt, UT: Roosevelt Municipal",14579
ROM,"Rome, Italy: Rome Metropolitan Area",14580
ROO,"Rondonopolis, Brazil: Maestro Marinho Franco",14581
ROP,"Rota, TT: Benjamin Taisacan Manglona International",14582
ROR,"Koror, Palau: Babelthuap",14583
ROS,"Rosario, Argentina: Rosario Airport",14584
ROT,"Rotorua, New Zealand: Rotorua Airport",14585
ROU,"Russe, Bulgaria: Bulg",14586
ROV,"Rostov, Russia: Rostov Airport",14587
ROW,"Roswell, NM: Roswell Air Center",14588
ROX,"Roseau, MN: Roseau Municipal/Rudy Billberg Field",14589
ROZ,"Rota, Spain: Rota Airport",16334
ZXA,"Rota, Spain: Rota Airport",16334
RPN,"Rosh-Pina, Israel: Izhak Ben Yaakov",14590
RPR,"Raipur, India: Swami Vivekananda",14591
RPX,"Roundup, MT: Roundup Airport",14592
RQA,"Lone Pine, CA: Lone Pine Death Valley",14593
RQB,"Atomic City, ID: Big Southern Butte",14594
RQC,"Harlowton, MT: Wheatland County at Harlowton",14595
RQD,"Mendota, CA: William Robert Johnston Municipal",14596
RQE,"Prosser, WA: Prosser Airport",14597
RQF,"Lincolnton, NC: Lincolnton-Lincoln County Regional",14598
RQG,"Covington, TN: Covington Municipal",14599
RQH,"Perkasie, PA: Pennridge",14600
RQI,"Nixon Fork Mine, AK: Nixon Fork Mine Airport",14601
RQJ,"Jafr, Jordan: King Feisal AB",14602
RQK,"China Lake, CA: China Lake Naws",14603
RQL,"Lowell, IN: Lowell Airport",14604
RQM,"Sterling, MA: Sterling Airport",14605
RQN,"Cave Junction, OR: Illinois Valley",14606
RQO,"Seneca, NY: Seneca AAF",14607
RQP,"Lovington, NM: Lea County-Zip Franklin Memorial",14608
RQQ,"Woodland, CA: Watts/Woodland",14609
RQR,"Harbor Springs, MI: Harbor Springs Airport",14610
RQS,"Springwater, Canada: Springwater Barrie Airpark",14611
RQT,"Lubbock, TX: Lubbock Executive Airpark",14612
RQU,"Wasco, CA: Wasco-Kern County",14613
RQV,"Salt Lake City, UT: South Valley Regional",14614
RQW,"Parowan, UT: Parowan Airport",14615
RQX,"Burlington, CO: Kit Carson County",14616
RQY,"Comanche, TX: Comanche County-City",14617
RQZ,"Mary Esther, FL: Hurlburt Field",14618
RRG,"Rodrigues Island, Mauritius: Plaine Corail",14620
RRK,"Rourkela, India: Rourkela Airport",14621
RRS,"Roros, Norway: Roros Airport",14622
RRT,"Warroad, MN: Warroad International Memorial",14623
WAX,"Warroad, MN: Warroad International Memorial",14623
RSA,"Santa Rosa, Argentina: Santa Rosa Airport",14624
RSC,"Skulte, U.S.S.R.: Skulte Airport",14625
RSD,"Rock Sound, The Bahamas: Rock Sound Airport",14626
RSH,"Russian Mission, AK: Russian Mission Airport",14627
RSJ,"Rosario, WA: Rosario Seaplane Base",14628
RSL,"Russell, KS: Russell Municipal",14629
RSN,"Ruston, LA: Ruston Regional",14630
RSP,"Raspberry Strait, AK: Raspberry Straits",14631
RSS,"Roseires, Sudan: Roseires Airport",14632
RST,"Rochester, MN: Rochester International",14633
RSU,"Yosu, South Korea: Yeosu",14634
RSW,"Fort Myers, FL: Southwest Florida International",14635
RTA,"Rotuma, Fiji: Rotuma Airport",14636
RTB,"Roatan Island, Honduras: Juan Manuel Galvez International",14637
RTE,"Marguerite Bay, AK: Marguerite Bay Airport",14638
RTM,"Rotterdam, Netherlands: Rotterdam Airport",14639
RTN,"Raton, NM: Raton Municipal/Crews Field",14640
RTO,"Colton, CA: Morrow Field",14641
RTS,"Rottnest Island, Australia: Rottnest Island Airport",14642
RU1,"Keperveyem, Russia: Keperveyem Airport",14643
RU2,"Ramenskoye, Russia: Ramenskoye Airport",14644
RU3,"Saratov, Russia: Engels AFB",16452
RU4,"Moscow, Russia: Ostafyevo",16516
RUH,"Riyadh, Saudi Arabia: King Khalid International",14645
RUI,"Ruidoso, NM: Sierra Blanca Regional",14646
RUN,"Reunion Island, Reunion: La Reunion Roland Garros",14647
RUT,"Rutland, VT: Rutland - Southern Vermont Regional",14648
RUV,"Rubelsanto, Guatemala: Rubelsanto Airport",14649
RVA,"Farafangana, Madagascar: Farafangana Airport",14651
RVN,"Rovaniemi, Finland: Rovaniemi Airport",14652
RVS,"Tulsa, OK: Tulsa Riverside",14653
RVY,"Rivera, Uruguay: Cerro Chapeu",14654
RWB,"Rowan Bay, AK: Rowan Bay Airport",14655
RWI,"Rocky Mount, NC: Rocky Mount-Wilson Regional",14656
RWL,"Rawlins, WY: Rawlins Municipal/Harvey Field",14657
RWN,"Rovno, Ukraine: Rivne International",16945
RXB,"Rodman Bay, AK: Rodman Bay Airport",14658
RXS,"Roxas City, Philippines: Roxas",14659
RYE,"Greeley, CO: Weld County Municipal",14660
RYG,"Moss, Norway: Rygge",14661
RYK,"Rahim Yar Khan, Pakistan: Sheikh Zayed International",14662
RZA,"Santa Cruz, Argentina: Santa Cruz Airport",14663
RZE,"Rzeszow, Poland: Jasionka",14664
RZR,"Ramsar, Iran: Ramsar Airport",14665
RZS,"Sawan, Pakistan: Sawan Airport",14666
S24,"Fremont, OH: Sandusky County Regional",16459
S27,"Kalispell, MT: Kalispell City",14669
SA1,"Thablotin, Saudi Arabia: Thablotin Airport",16494
SA2,"Um Almelh, Saudi Arabia: Um Almelh Airport",16664
SA3,"Aradah, Saudi Arabia: Aradah Airport",16960
SAA,"Saratoga, WY: Shively Field",14670
SAB,"Saba, Bonaire, Sint Eustatius, and Saba: Juancho E. Yrausquin",14671
SAC,"Sacramento, CA: Sacramento Executive",14672
SAD,"Safford, AZ: Safford Regional",14673
SAF,"Santa Fe, NM: Santa Fe Municipal",14674
SAG,"Sagwon, AK: Sagwon Airport",14675
SAH,"Sana'a, Yemen: Sana'a International",14676
SAL,"San Salvador, El Salvador: San Oscar A Romero and Galdamez International",14677
SAM,"Salamo, Papua New Guinea: Salamo Airport",14678
SAN,"San Diego, CA: San Diego International",14679
SAO,"Sao Paulo, Brazil: Sao Paulo Metropolitan Area",14680
SAP,"San Pedro Sula, Honduras: Ramon Villeda Morales International",14681
SAQ,"San Andros, The Bahamas: San Andros Airport",14682
SAT,"San Antonio, TX: San Antonio International",14683
SAU,"Sabu, Indonesia: Tardamu",14684
SAV,"Savannah, GA: Savannah/Hilton Head International",14685
SAW,"Istanbul, Turkey: Sabiha Gokcen",14686
SAX,"Sambu, Panama: Sambu Airport",14687
SAY,"Sienna, Italy: Ampugnano",14688
SBA,"Santa Barbara, CA: Santa Barbara Municipal",14689
SBC,"Selbang, Papua New Guinea: Selbang Airport",14690
SBD,"San Bernardino, CA: San Bernardino International",14691
SBH,"Saint Barthelemy, Saint Barthelemy: Saint Barthelemy Airport",14692
SBK,"St. Brieuc, France: St. Brieuc Airport",14693
SBL,"Santa Ana, Bolivia: Santa Ana del Yacuma",14694
SBM,"Sheboygan, WI: Sheboygan County Memorial",14695
SBN,"South Bend, IN: South Bend International",14696
SBO,"Salina, UT: Salina-Gunnison",14697
SBP,"San Luis Obispo, CA: San Luis County Regional",14698
SBS,"Steamboat Springs, CO: Steamboat Springs/Bob Adams Field",14699
SBT,"San Bernardino, CA: Tri-City",14700
SBU,"Springbok, South Africa: Springbok Airport",14701
SBV,"South Boston, VA: William M Tuck",14702
SBW,"Sibu, Malaysia: Sibu Airport",14703
SBY,"Salisbury, MD: Salisbury-Ocean City/Wicomico Regional",14704
SBZ,"Sibiu, Romania: Sibiu Airport",14705
SC1,"Beaufort, SC: Beaufort MCAS",14706
SC2,"Winnsboro, SC: Fairfield County",14707
SC3,"Conway, SC: Conway-Horry County",14708
SC4,"Moncks Corner, SC: Berkeley County",16577
SC5,"Summerville, SC: Summerville Airport",16583
SC6,"Charleston, SC: Charleston Executive",16876
SCC,"Deadhorse, AK: Deadhorse Airport",14709
SCE,"State College, PA: University Park",14711
SCF,"Phoenix, AZ: Scottsdale",14712
SCH,"Schenectady, NY: Schenectady County",14713
SCI,"San Cristobal, Venezuela: San Cristobal Airport",14714
SCJ,"Smith Cove, AK: Smith Cove Airport",14715
SCK,"Stockton, CA: Stockton Metro",14716
SCL,"Santiago, Chile: Arturo Merino Benitez International",14717
SCM,"Scammon Bay, AK: Scammon Bay Airport",14718
SCN,"Saarbrucken, Germany: Saarbruecken",14719
SCO,"Aktau, Kazakhstan: Shevchenko",14720
SCQ,"Santiago de Compostela, Spain: Santiago",14721
SCU,"Santiago, Cuba: Antonio Maceo International",14722
SCV,"Suceava, Romania: Suceava Airport",14723
SCX,"Salina Cruz, Mexico: Nas Salina Cruz",14724
SCY,"San Cristobal, Ecuador: San Cristobal Airport",14725
SD1,"Onida, SD: Onida Municipal",14726
SD2,"Gregory, SD: Gregory Municipal Flynn Field",16453
SD3,"Hot Springs, SD: Hot Springs Municipal",16964
SD4,"Sturgis, SD: Sturgis Municipal",16972
SDA,"Baghdad, Iraq: Baghdad International",14727
SDD,"Lubango, Angola: Lubango Airport",14728
SDE,"Santiago del Estero, Argentina: Santiago del Estero Airport",14729
SDF,"Louisville, KY: Louisville Muhammad Ali International",14730
SDG,"Sanandaj, Iran: Sanandaj Airport",16399
SDH,"Santa Rosa de Copan, Honduras: Santa Rosa de Copan Airport",14732
SDJ,"Sendai, Japan: Sendai Airport",14733
SDK,"Sandakan, Malaysia: Sandakan Airport",14734
SDL,"Sundsvall, Sweden: Sundsvall Timra",14735
SDM,"San Diego, CA: Brown Field Municipal",14736
SDN,"Anda, Norway: Sandane",14737
SDP,"Sandpoint, AK: Sand Point",14738
SDQ,"Santo Domingo, Dominican Republic: De Las Americas International",14739
SDR,"Santander, Spain: Santander Airport",14740
SDT,"Saidu Sharif, Pakistan: Saidu Sharif Airport",14741
SDU,"Rio de Janeiro, Brazil: Santos Dumont",14742
SDV,"Tel Aviv, Israel: Sde Dov",14743
SDX,"Sedona, AZ: Sedona Airport",14744
SDY,"Sidney, MT: Sidney Richland Regional",14745
SE1,"Solleftea, Sweden: Solleftea Airport",14746
SEA,"Seattle, WA: Seattle/Tacoma International",14747
SEB,"Sebha, Libya: Sebha Airport",14748
SEE,"San Diego, CA: Gillespie Field",14749
SEF,"Sebring, FL: Sebring Regional",14750
SEG,"Selinsgrove, PA: Penn Valley",14751
SEL,"Seoul, South Korea: Kimpo International/Seoul Metropolitan Area",14752
SEM,"Selma, AL: Craig Field",14753
SEN,"Southend-On-Sea, United Kingdom: Southend",14754
SEQ,"Sungai Pakning, Indonesia: Sungai Pakning Airport",14755
SER,"Seymour, IN: Freeman Municipal",14756
SES,"Selma, AL: Selfield",14757
SEY,"Selibaby, Mauritania: Selibaby Airport",14758
SEZ,"Mahe Islands, Seychelles: Seychelles International",14759
SFA,"Sfax, Tunisia: El Maou",14760
SFB,"Sanford, FL: Orlando Sanford International",14761
SFC,"Saint Francois, Guadeloupe: Saint Francois Airport",14762
SFD,"San Fernando, Venezuela: Las Flecheras",14763
SFF,"Spokane, WA: Felts Field",14764
SFG,"Grand Case, Saint Martin: L'Esperance",14765
SFH,"San Felipe, Mexico: San Felipe International",14766
SFJ,"Sondre Stromfjord, Greenland: Sondrestrom Air Base",14767
SFL,"Sao Filipe, Cape Verde: Sao Filipe Airport",14768
SFM,"Sanford, ME: Sanford Seacoast Regional",14769
SFN,"Santa Fe, Argentina: Sauce Viejo",14770
SFO,"San Francisco, CA: San Francisco International",14771
SFP,"Surfers Paradise, Australia: Surfers Paradise Airport",14772
SFQ,"Sanliurfa, Turkey: Sanliurfa Airport",14773
SFS,"Subic Bay, Philippines: Subic Bay International",14774
SFT,"Skelleftea, Sweden: Skelleftea Airport",14775
SFU,"Safia, Papua New Guinea: Safia Airport",14776
SFW,"Santa Fe, Panama: Santa Fe Airport",14777
SFZ,"Smithfield, RI: North Central State",14778
SGB,"Singaua, Papua New Guinea: Singaua Airport",14779
SGC,"Surgut, Russia: Surgut Airport",14780
SGD,"Sonderborg, Denmark: Sonderborg Airport",14781
SGE,"Siegen, Germany: Siegerland",14782
SGF,"Springfield, MO: Springfield-Branson National",14783
SGG,"Simanggang, Malaysia: Simanggang Airport",14784
SGH,"Springfield, OH: Springfield-Beckley Municipal",14785
SGJ,"Sagarai, Papua New Guinea: Sagarai Airport",14786
SGM,"San Ignacio, Mexico: San Ignacio Airport",14788
SGN,"Ho Chi Minh City, Vietnam: Tan Son Nhat International",14789
SGO,"St. George, Australia: Saint George",14790
SGP,"Shay Gap, Australia: Shay Gap Airport",14791
SGR,"Sugar Land, TX: Sugar Land Regional",14792
SGT,"Stuttgart, AR: Stuttgart Municipal Carl Humphrey Field",14793
SGU,"St. George, UT: St George Regional",14794
SGW,"Saginaw Bay, AK: Saginaw",14795
SGX,"Songea, Tanzania: Songea Airport",14796
SGY,"Skagway, AK: Skagway Airport",14797
SGZ,"Singora, Thailand: Songkhla",14798
SHA,"Shanghai, China: Hongqiao International",14799
SHB,"Nakashibetsu, Japan: Nakashibetsu Airport",14800
SHC,"Shire Indasilase, Ethiopia: Shire Major General Haelom",14801
SHD,"Staunton, VA: Shenandoah Valley Regional",14802
SHE,"Shenyang, China: Taoxian",14803
SHG,"Shungnak, AK: Shungnak Airport",14804
SHH,"Shishmaref, AK: Shishmaref Airport",14805
SHI,"Shimojishima, Japan: Shimojishima Airport",14806
SHJ,"Sharjah, United Arab Emirates: Sharjah International",14807
SHL,"Shillong, India: Barapani",14808
SHM,"Nanki Shirahama, Japan: Nanki Shirahama Airport",14809
SHN,"Shelton, WA: Sanderson Field",14810
SHO,"Sokcho, South Korea: G 407",14811
SHR,"Sheridan, WY: Sheridan County",14812
SHU,"Smith Point, Australia: Smith Point Airport",14813
SHV,"Shreveport, LA: Shreveport Regional",14814
SHW,"Sharurah, Saudi Arabia: Sharurah Airport",14815
SHX,"Shageluk, AK: Shageluk Airport",14816
SIA,"Xi'an, China: Xi'an Xiguan",14817
SID,"Sal Island, Cape Verde: Amilcar Cabral International",14818
SIG,"San Juan, PR: Isla Grande",14819
SIH,"Silgadi Doti, Nepal: Silgadi Doti Airport",14820
SII,"Sidi Ifni, Morocco: Sidi Ifni Airport",14821
SIK,"Sikeston, MO: Sikeston Memorial Municipal",14822
SIM,"Simbai, Papua New Guinea: Simbai Airport",14823
SIN,"Singapore, Singapore: Singapore Changi International",14824
SIO,"Smithton, Australia: Smithton Airport",14825
SIP,"Simferopol, Ukraine: Simferopol International",14826
SIR,"Sion, Switzerland: Sion Airport",16597
SIS,"Sishen, South Africa: Sishen Airport",14827
SIT,"Sitka, AK: Sitka Rocky Gutierrez",14828
SIU,"Siuna, Nicaragua: Siuna Airport",14829
SIY,"Montague, CA: Siskiyou County",14830
SJC,"San Jose, CA: Norman Y. Mineta San Jose International",14831
SJD,"San Jose del Cabo, Mexico: San Jose del Cabo International",14832
SJF,"St. John, VI: St. John Airport",14833
SJI,"San Jose, Philippines: San Jose Airport",14834
SJJ,"Sarajevo, Bosnia and Herzegovina: Sarajevo Airport",14835
SJK,"Sao Jose Dos Campos, Brazil: Professor Urbano Ernesto Stumpf",14836
SJN,"St. Johns, AZ: St. Johns Industrial Air Park",14837
SJO,"San Jose, Costa Rica: Juan Santamaria International",14838
SJP,"Sao Jose Do Rio Preto, Brazil: Professor Eriberto Manoel Reino",14839
SJQ,"Sesheke, Zambia: Sesheke Airport",14840
SJS,"San Jose, Bolivia: San Jose de Chiquitos",14841
SJT,"San Angelo, TX: San Angelo Regional/Mathis Field",14842
SJU,"San Juan, PR: Luis Munoz Marin International",14843
SJV,"San Javier, Bolivia: San Javier Airport",14844
SJW,"Shijiazhuang, China: Zhengding",14845
SJY,"Seinajoki, Finland: Seinajoki Airport",14846
SJZ,"Sao Jorge Island, Portugal: Sao Jorge",14847
SKA,"Spokane, WA: Fairchild AFB",14848
SKB,"St. Kitts, Saint Kitts and Nevis: Robert L Bradshaw International",14849
SKC,"Suki, Papua New Guinea: Suki Airport",14850
SKD,"Samarkand, Uzbekistan: Samarkand Airport",14851
SKE,"Skien, Norway: Geiteryggen",14852
SKF,"San Antonio, TX: Kelly Field",14853
SKG,"Thessaloniki, Greece: Makedonia",14854
SKJ,"Sitkinak, AK: Sitkinak CGS",14855
SKK,"Shaktoolik, AK: Shaktoolik Airport",14856
SKL,"Isle of Skye, United Kingdom: Isle of Skye Airport",14857
SKN,"Stokmarknes, Norway: Stokmarknes Airport",14858
SKO,"Sokoto, Nigeria: Sokoto Airport",14859
SKP,"Skopje, Macedonia: Skopje International",14860
SKS,"Skrydstrup, Denmark: Skrydstrup Airport",14861
SKT,"Sialkot, Pakistan: Sialkot International",16471
SKU,"Skiros, Greece: Skiros Airport",14862
SKW,"Skwentna, AK: Skwentna Airport",14863
SKX,"Saransk, Russia: Saransk Airport",14864
SKY,"Sandusky, OH: Griffing Sandusky",14865
SKZ,"Sukkur, Pakistan: Begum Nusrat Bhutto",14866
SLA,"Salta, Argentina: Salta Airport",14867
SLB,"Storm Lake, IA: Storm Lake Municipal",14868
SLC,"Salt Lake City, UT: Salt Lake City International",14869
SLD,"Sliac, Slovakia: Sliac Airport",14870
SLE,"Salem, OR: McNary Field",14871
SLH,"Sola, Vanuatu: Sola Airport",14872
SLI,"Solwezi, Zambia: Solwezi Airport",14873
SLJ,"Chandler, AZ: Stellar Airpark",14874
SLK,"Saranac Lake/Lake Placid, NY: Adirondack Regional",14875
SLL,"Salalah, Oman: Salalah Airport",14876
SLM,"Salamanca, Spain: Matacan",16575
SLN,"Salina, KS: Salina Regional",14877
SLO,"Salem, IL: Salem/Leckrone",14878
SLP,"San Luis Potosi, Mexico: San Luis Potosi International",14879
SLQ,"Sleetmute, AK: Sleetmute Airport",14880
SLR,"Sulphur Springs, TX: Sulphur Springs Municipal",14881
SLS,"Silistra, Bulgaria: Silistra Polkovnik-Lambrinovo",14882
SLT,"Salida, CO: Salida Airport Harriett Alexander Field",14883
SLU,"St. Lucia, Saint Lucia: George F Charles",14884
SLV,"Shimla, India: Shimla Airport",14885
SLW,"Saltillo, Mexico: Saltillo International",14886
SLX,"Salt Cay, Turks and Caicos Islands: Salt Cay Airport",14887
SLZ,"Sao Luiz, Brazil: Marechal Cunha Machado International",14888
SMA,"Santa Maria, Portugal: Santa Maria Airport",14889
SMB,"Cerro El Sombrero, Chile: Franco Bianco",14890
SMC,"Santa Maria, Colombia: Santa Maria Airport",14891
SME,"Somerset, KY: Lake Cumberland Regional",14892
SMF,"Sacramento, CA: Sacramento International",14893
SMI,"Samos, Greece: Samos Airport",14894
SMK,"St. Michael, AK: St. Michael Airport",14895
SML,"Stella Maris, The Bahamas: Estate Airstrip",14896
SMN,"Salmon, ID: Lemhi County",14897
SMO,"Santa Monica, CA: Santa Monica Municipal",14898
SMQ,"Sampit, Indonesia: H.Asan",16488
SMR,"Santa Marta, Colombia: Simon Bolivar",14900
SMS,"St. Marie, Madagascar: Sainte Marie",14901
SMT,"Stone Mountain, GA: Stone Mountain Airport",14902
SMU,"Sheep Mountain, AK: Sheep Mountain Airport",14903
SMV,"St. Moritz, Switzerland: Samedan",14904
SMX,"Santa Maria, CA: Santa Maria Public/Capt. G. Allan Hancock Field",14905
SMY,"Simenti, Senegal: Simenti Airport",14906
SMZ,"Stoelmanseiland, Suriname: Stoelmanseiland Airport",14907
SNA,"Santa Ana, CA: John Wayne Airport-Orange County",14908
SNB,"Snake Bay, Australia: Snake Bay Airport",14909
SNC,"Salinas, Ecuador: General Ulpiano Paez",14910
SNE,"Sao Nicolau, Cape Verde: Preguica",14911
SNF,"San Felipe, Venezuela: Sub Teniente Nestor Arias",14912
SNG,"San Ignacio de Velasco, Bolivia: Cap. Av. Juan Cochamanidis Saucedo",14913
SNI,"Greenville/Sinoe, Liberia: Greenville/Sinoe Airport",14914
SNK,"Snyder, TX: Winston Field",14915
SNL,"Shawnee, OK: Shawnee Regional",14916
SNM,"San Ignacio de Moxos, Bolivia: San Ignacio de Moxos Airport",14917
SNN,"Shannon, Ireland: Shannon Airport",14918
SNP,"St. Paul, AK: St. Paul Island",14919
SNQ,"San Quintin, Mexico: San Quintin Southeast",14920
SNR,"St. Nazaire, France: Saint Nazaire Montoir",14921
SNS,"Salinas/Monterey, CA: Salinas Municipal",14922
SNT,"Las Cruces, Colombia: Las Cruces Airport",14923
SNU,"Santa Clara, Cuba: Abel Santamaria International",14924
SNV,"Santa Elena, Venezuela: Wonkin",14925
SNW,"Thandwe, Burma: Thandwe Airport",14926
SNY,"Sidney, NE: Sidney Municipal/Lloyd W. Carr Field",14927
SOB,"Sarmellek, Hungary: Balaton",16638
SOC,"Solo City, Indonesia: Adi Soemarmo International",14928
SOF,"Sofia, Bulgaria: Sofia Airport",14929
SOG,"Sogndal, Norway: Sogndal Airport",14930
SOI,"South Molle Island, Australia: S Molle",14931
SOJ,"Sorkjosen, Norway: Sorkjosen Airport",14932
SOK,"Semonkong, Lesotho: Semonkong Airport",14933
SOL,"Solomon, AK: Solomon State Field",14934
SOM,"San Tome, Venezuela: Don Edmundo Barrios International",14935
SON,"Espiritu Santo, Vanuatu: Espiritu",14936
SOP,"Pinehurst/Southern Pines, NC: Moore County",14938
