Code_x,Description,Code_y
01A,"Afognak Lake, AK: Afognak Lake Airport",10001
03A,"Granite Mountain, AK: Bear Creek Mining Strip",10003
04A,"Lik, AK: Lik Mining Camp",10004
05A,"Little Squaw, AK: Little Squaw Airport",10005
06A,"Kizhuyak, AK: Kizhuyak Bay",10006
07A,"Klawock, AK: Klawock Seaplane Base",10007
08A,"Elizabeth Island, AK: Elizabeth Island Airport",10008
09A,"Homer, AK: Augustin Island",10009
1AK,"Mertarvik, AK: Mertarvik Quarry Road Landing Strip",16923
1B1,"Hudson, NY: Columbia County",10010
1CA,"Rio Vista, CA: Rio Vista Municipal",16843
1FL,"Titusville, FL: Space Florida Launch Landing Facility",13750
1G4,"Peach Springs, AZ: Grand Canyon West",10011
1G4,"Peach Springs, AZ: Grand Canyon West",11398
DQR,"Peach Springs, AZ: Grand Canyon West",10011
DQR,"Peach Springs, AZ: Grand Canyon West",11398
1GA,"Hampton, GA: Atlanta Speedway",16842
1N7,"Blairstown, NJ: Blairstown Airport",10012
1NC,"Roanoke Rapids, NC: Halifax Northampton Regional",14668
1NJ,"Andover, NJ: Aeroflex Andover",16990
1NY,"Penn Yan, NY: Penn Yan Airport",16571
1OH,"Willoughby, OH: Lake County Executive",16935
1PA,"Connellsville, PA: Joseph A Hardy Connellsville",16959
1TN,"Lexington Parsons, TN: Beech River Regional",16840
1TX,"Dumas, TX: Moore County",16853
1VA,"Warrenton, VA: Warrenton Fauquier",16951
1WA,"Deer Park, WA: Deer Park Airport",16908
2AK,"Deerpark, AK: Deer Park",16982
2CA,"Delano, CA: Delano Municipal",16844
2FL,"West Palm Beach, FL: North Palm Beach County Gen Aviation",16901
2GA,"Camilla, GA: Camilla Mitchell County",16848
2NC,"Asheboro, NC: Asheboro Regional",16934
2NY,"Port Washington, NY: Sands Point Seaplane Base",16830
2TN,"Dayton, TN: Mark Anton",16898
2TX,"Brenham, TX: Brenham Municipal",16897
2VA,"Williamsburg, VA: Camp Peary Landing Strip",16980
2WK,"Odessa, WA: Odessa Municipal",16983
3AK,"Tintina, AK: Gold Mining Landing Strip",16992
3CA,"Garberville, CA: Garberville Airport",16907
3GA,"Blakely, GA: Early County",16875
3NC,"Hendersonville, NC: Hendersonville Airport",16991
3NY,"Suffolk, NY: Sebonac",16831
3TN,"Elizabethon, TN: Elizabethton Municipal",16940
3TX,"Lancaster, TX: Lancaster Regional",16880
4AK,"North Pole, AK: Bradley Sky Ranch",16994
4CA,"Davis, CA: University",16920
4CL,"El Mirage, CA: El Mirage Field Adelanto",16914
4GA,"Atlanta, GA: Paulding Memorial Hospital Heliport",16913
4NY,"Millbrook, NY: Johnson Landing Strip",16904
4TX,"Lajitas, TX: Lajitas International",16900
5AK,"Lawing, AK: Lawing Airport",16995
5NY,"Malone, NY: Malone Dufort",16925
5TX,"Edinburg, TX: South Texas International at Edinburg",16909
6B0,"Middlebury, VT: Middlebury State",16429
6NY,"New York, NY: Sag Harbor",16955
6TX,"Leakey, TX: Real County",16916
7AK,"Akun, AK: Akun Airport",16567
7NY,"New York, NY: Shelter Island",16956
7TX,"Graford, TX: Possum Kingdom",16919
8F3,"Crosbyton, TX: Crosbyton Municipal",10013
8NY,"New York, NY: Noyack",16957
8TX,"Waco, TX: McGregor Exec",16926
9NY,"Shelter Island, NY: Sbnysh",16965
9TX,"Center, TX: Center Municipal",16942
A01,"Fairbanks/Ft. Wainwright, AK: Blair Lake",10014
A02,"Deadmans Bay, AK: Deadmans Bay Airport",10015
A03,"Hallo Bay, AK: Hallo Bay Airport",10016
A04,"Red Lake, AK: Red Lake Airport",10017
A05,"Shell Lake, AK: Shell Lake Airport",10018
A06,"Kougarok, AK: Navigator Airstrip",10019
A07,"Selawik, AK: Roland Norton Memorial",10020
A08,"Pillar Bay, AK: Pillar Bay Airport",10021
A09,"Johnstone Point, AK: Johnstone Point Airport",10022
A11,"Bell Creek, AK: Bell Creek Airport",10024
A12,"Cinnabar, AK: Cinnabar Airport",10025
A13,"Mountaintop Mine, AK: Mountaintop Mine Airport",10026
A14,"Whitebear, AK: Whitebear Airport",10027
A15,"Puviaq, AK: Puviaq Airport",10028
A16,"Arley Lake, AK: Arley Lake Airport",10029
A17,"Port Vita, AK: Port Vita Airport",10030
A18,"Kantishna, AK: Kantishna Airport",10031
A1K,"Deadhorse1, AK: Point Thomson Airstrip",16668
A1L,"Cullman, AL: Cullman Regional Folsom Field",16811
A20,"Alpine, AK: Alpine Airstrip",10033
A20,"Alpine, AK: Alpine Airstrip",11388
DQH,"Alpine, AK: Alpine Airstrip",10033
DQH,"Alpine, AK: Alpine Airstrip",11388
A21,"Serpentine, AK: Serpentine Airport",10034
A22,"Driftwood Bay, AK: Driftwood Bay Airport",10035
A23,"Bradley Lake, AK: Bradley Lake Airport",10036
A24,"Chilkat Lake, AK: Chilkat Lake Airport",10037
A25,"Nugget Creek, AK: Nugget Creek Airport",10038
A26,"Ivotuk, AK: Ivotuk Airstrip",10039
A27,"Pogo Mines, AK: Pogo Mines Airport",10040
A28,"Ayakulik River, AK: Ayakulik River Airport",10041
A29,"Kiluda Bay, AK: Kiluda Bay Airport",10042
A2K,"Bartletts, AK: Bartletts Airport",10770
BSZ,"Bartletts, AK: Bartletts Airport",10770
A2L,"Fort Payne, AL: Isbell Field",16810
A30,"Terror Lake, AK: Terror Lake Airport",10043
A31,"Selief Bay, AK: Selief Bay Airport",10044
A34,"Laura Lake, AK: Laura Lake Airport",10047
A35,"Kaktovik, AK: Bullen Point AFS",11828
A36,"Deep Bay, AK: Deep Bay Airport",10049
A37,"Kako, AK: Kako Airport",10050
A38,"Molly Creek, AK: Molly Creek Airport",10051
A39,"Ptarmigan Lake, AK: Ptarmigan Lake Airport",10052
A3K,"Smith Bay, AK: Smith Bay Airport",16696
A40,"Cape Simpson, AK: Cape Simpson Airport",10053
A41,"Kogru River, AK: Kogru River Airport",10054
A42,"Teshepkuk Lake, AK: Teshepkuk Lake Airport",10055
A43,"Kodiak Island, AK: Trident Basin Seaplane Base",10056
A45,"Lake Florence, AK: Lake Florence Airport",10058
A46,"Lake Hasselborg, AK: Lake Hasselborg Airport",10059
A47,"Distin Lake, AK: Distin Lake Airport",10060
A48,"Port Hobron, AK: Port Hobron Airport",10061
A49,"Mooseville Airstrip, AK: Mooseville Airstrip Airport",10062
A4K,"Dune Lake, AK: Dune Lake Airport",16698
A50,"Big Bay, AK: Big Bay Airport",10063
A51,"Wien Lake, AK: Wien Lake Airport",10064
A52,"Silver Salmon Creek, AK: Silver Salmon Creek Airport",10065
A53,"Blear Lake, AK: Blear Lake Airport",10066
A54,"Cannery Bay, AK: Cannery Bay Airport",10067
A56,"Bear Lake, AK: Johnsons Landing",10069
A57,"International Seafoods, AK: International Seafoods Airport",10070
VZK,"International Seafoods, AK: International Seafoods Airport",10070
A58,"Cosna River, AK: Cosna River Airport",10071
A59,"Ivatuk, AK: Ivatuk Airport",10072
A5K,"Paxson, AK: Paxson Airport",16803
A61,"Cape Sarichef, AK: Cape Sarichef Airport",10074
A62,"Taylor Mountain Mine, AK: Taylor Mountain",10075
A63,"Yukon Charley Rivvers, AK: Coal Creek",10076
A65,"Karluk Portage, AK: Karluk Portage Airport",10078
A66,"Hope, AK: Hope Airport",10079
A67,"Viekoda Bay, AK: Viekoda Bay Airport",10080
A69,"Cold Bay, AK: Cathedral Strip",10082
A6K,"Fairbanks1, AK: Van Curlers Sandbar",16720
A70,"Village Islands, AK: Village Islands Airport",10083
A71,"Homer, AK: Bear Cove Farm",10084
A72,"Chinitna Bay, AK: Chinitna Bay Airport",10085
A73,"McKinley Park, AK: McKinley National Park",10086
A74,"Nanwalek, AK: Dog Fish Bay",10087
A75,"Malina Bay, AK: Malina Bay Airport",10088
A76,"Red Fox Bay, AK: Red Fox Bay Airport",10089
A77,"Shearwater, AK: Shearwater Airport",10090
A78,"Cape Simpson, AK: Lake",10091
A79,"Cape Simpson, AK: Cape Simpson No. 1",10092
A7K,"Nakochna, AK: Nakochna Airport",16723
A80,"Cape Simpson, AK: Cape Simpson No. 7",10093
A81,"Aglaq, AK: Cape Simpson #1",10094
A82,"Nikiski, AK: Nikiski Private Airstrip",10095
A83,"Petrof Point, AK: Petrof Point Airport",10096
A84,"Denali, AK: Denali West Lodge Private",10097
A85,"Big River, AK: Big River Airport",10098
A87,"Carry Inlet, AK: Carry Inlet Airport",10100
A89,"Montague Island, AK: Montague Island Airport",10102
A8K,"Granite Point, AK: Granite Point Ndb",15934
A90,"Shannon Pond, AK: Shannon Pond Airport",10103
A91,"Omalik Lagoon, AK: Omalik Lagoon Airport",10104
A92,"Omolik Lagoon, AK: Omolik Lagoon Airport",10105
A93,"Bradley Lake Project, AK: Bradley Lake Project Airport",10106
A94,"Barrow, AK: Ice Strip",10107
A94,"Barrow, AK: Ice Strip",10108
A94,"Barrow, AK: Ice Strip",10109
A95,"Barrow, AK: Ice Strip",10107
A95,"Barrow, AK: Ice Strip",10108
A95,"Barrow, AK: Ice Strip",10109
A96,"Barrow, AK: Ice Strip",10107
A96,"Barrow, AK: Ice Strip",10108
A96,"Barrow, AK: Ice Strip",10109
A97,"Akulik, AK: Akulik Air Strip",10110
A98,"Deadfall, AK: Deadfall Air Strip",10111
A99,"Eagle Creek, AK: Eagle Creek Airport",10112
A9K,"Healy, AK: Era Denali Heliport",16985
AA1,"Bethel, AK: Ice Kong",10113
AA2,"Naknek-1, AK: Icicle Seafoods",16662
AA4,"Kachemak Bay, AK: Glacier Split",10116
AA5,"Selby Lake, AK: Selby Lake Airport",10117
AA7,"Independence Creek, AK: Independence Creek Airport",16472
AA8,"Deadhorse, AK: Badami",11381
AA9,"Napaimute, AK: Napaimute Pioneer Airfield",16804
AAA,"Anaa, French Polynesia: Anaa Airport",10118
AAB,"Arrabury, Australia: Arrabury Station",10119
AAC,"El Arish, Egypt: El Arish International",10120
AAD,"Ad-Dabbah, Sudan: Ad-Dabbah Airport",16385
AAE,"Annaba, Algeria: Rabah Bitat",10121
AAF,"Apalachicola, FL: Apalachicola Regional Cleve Randolph Field",10122
AAH,"Aachen, Germany: Aachen Merzbrueck",10123
AAI,"Arraias, Brazil: Arraias Airport",10124
AAL,"Aalborg, Denmark: Aalborg Airport",10125
AAM,"Mala Mala, South Africa: Malamala",10126
AAN,"Al Ain, United Arab Emirates: Al Ain International",10127
AAO,"Anaco, Venezuela: Anaco Airport",10128
AAQ,"Anapa, Russia: Vityazevo",10129
AAR,"Aarhus, Denmark: Aarhus Airport",10130
AAU,"Asau, Samoa: Asau W Sam",10131
AAX,"Araxa, Brazil: Romeu Zema",10132
ABA,"Abakan, Russia: Abakan Airport",16387
ABD,"Abadan, Iran: Abadan Airport",10134
ABE,"Allentown/Bethlehem/Easton, PA: Lehigh Valley International",10135
ABI,"Abilene, TX: Abilene Regional",10136
ABJ,"Abidjan, Cote d'Ivoire: Felix Houphouet Boigny Abidjan International",10137
ABK,"Kabri Dar, Ethiopia: Kebri Dahar",10138
ABL,"Ambler, AK: Ambler River",10139
ABQ,"Albuquerque, NM: Albuquerque International Sunport",10140
ABR,"Aberdeen, SD: Aberdeen Regional",10141
ABS,"Abu Simbel, Egypt: Abu Simbel Airport",10142
ABT,"Al-Baha, Saudi Arabia: King Saud Bin Abdulaziz",10143
ABV,"Abuja, Nigeria: Nnamdi Azikiwe International",10144
ABX,"Albury, Australia: Albury Airport",10145
ABY,"Albany, GA: Southwest Georgia Regional",10146
ABZ,"Aberdeen, United Kingdom: Aberdeen Dyce",10147
ACA,"Acapulco, Mexico: Acapulco International",10148
ACB,"Bellaire, MI: Antrim County",10149
ACC,"Accra, Ghana: Kotoka International",10150
ACE,"Arrecife, Spain: Lanzarote",10151
ACH,"Altenrhein, Switzerland: St Gallen Altenrhein",10152
ACI,"Alderney, United Kingdom: Alderney Airport",10153
ACK,"Nantucket, MA: Nantucket Memorial",10154
ACT,"Waco, TX: Waco Regional",10155
ACU,"Achutupo, Panama: Achutupo Airport",10156
ACV,"Arcata/Eureka, CA: California Redwood Coast Humboldt County",10157
ACY,"Atlantic City, NJ: Atlantic City International",10158
ADA,"Adana, Turkey: Adana International",10159
ADB,"Izmir, Turkey: Adnan Menderes",10160
ADC,"Andakombe, Papua New Guinea: Andakombe Airport",10161
ADD,"Addis Ababa, Ethiopia: Bole International",10162
ADE,"Aden, Yemen: Aden International",10163
ADJ,"Amman, Jordan: Marka International",10164
ADK,"Adak Island, AK: Adak",10165
ADL,"Adelaide, Australia: Adelaide International",10166
ADM,"Ardmore, OK: Ardmore Municipal",10167
ADN,"Andes, Colombia: Andes Airport",10168
ADO,"Andamooka, Australia: Andamooka Airport",10169
ADQ,"Kodiak, AK: Kodiak Airport",10170
ADS,"Dallas, TX: Addison",10171
ADT,"Ada, OK: Ada Regional",16426
ADW,"Camp Springs, MD: Joint Base Andrews",10172
ADW,"Camp Springs, MD: Joint Base Andrews",13748
NSF,"Camp Springs, MD: Joint Base Andrews",10172
NSF,"Camp Springs, MD: Joint Base Andrews",13748
ADX,"St Andrews, United Kingdom: RAF Leuchars",10173
ADZ,"San Andres Island, Colombia: Gustavo Rojas Pinilla",10174
AE1,"Liwa, United Arab Emirates: Liwa Airbase",16592
AE2,"Sweihan, United Arab Emirates: Sweihan Airbase",16772
AED,"Aleneva, AK: Aleneva Airport",10176
AEG,"Padang Sidempuan, Indonesia: Aek Godang",10177
AEH,"Abeche, Chad: Abeche Airport",10178
AEO,"Aioun El Atrouss, Mauritania: Aioun El Atrouss Airport",10180
AEP,"Buenos Aires, Argentina: Aeroparque Jorge Newbery",10181
AER,"Adler/Sochi, Russia: Adler/Sochi Airport",10182
AES,"Aalesund, Norway: Alesund",10183
AET,"Allakaket, AK: Allakaket Airport",10184
AEX,"Alexandria, LA: Alexandria International",10185
AEY,"Akureyri, Iceland: Akureyri Airport",10186
AF2,"Lashkar Gah, Afghanistan: Bastion Airfield",16461
AF3,"Dwyer, Afghanistan: Dwyer Airport",16557
AF4,"Shindand, Afghanistan: Shindand Airport",16559
AFA,"San Rafael, Argentina: San Rafael Airport",10188
AFF,"Colorado Springs, CO: USAF Academy Airfield",10189
AFK,"Nebraska, NE: Nebraska City Municipal",10190
AFO,"Afton, WY: Afton Municipal",10191
AFP,"Wadesboro, NC: Anson County Jeff Cloud Field",10192
AFU,"Doha, Qatar: Al Udeid Air Base",15968
XJD,"Doha, Qatar: Al Udeid Air Base",15968
XXJ,"Doha, Qatar: Al Udeid Air Base",15968
AFW,"Dallas/Fort Worth, TX: Perot Field Fort Worth Alliance",10194
AFY,"Afyon, Turkey: Afyon Airport",10195
AGA,"Agadir, Morocco: Inezgane",10196
AGB,"Augsburg, Germany: Augsburg Airport",10197
AGC,"Pittsburgh, PA: Allegheny County",10198
AGF,"Agen, France: Agen La Garenne",10199
AGG,"Angoram, Papua New Guinea: Angoram Airport",10200
AGH,"Angelholm/Helsingborg, Sweden: Angelholm",10201
AGK,"Kagua, Papua New Guinea: Kagua Airport",10202
AGL,"Wanigela, Papua New Guinea: Wanigela Airport",10203
AGN,"Angoon, AK: Angoon Seaplane Base",10204
AGP,"Malaga, Spain: Malaga Airport",10205
AGQ,"Agrinion, Greece: Agrinion Airport",10206
AGR,"Agra, India: Agra Airport",10207
AGS,"Augusta, GA: Augusta Regional at Bush Field",10208
AGT,"Ciudad del Este, Paraguay: Guarani International",10209
AGU,"Aguascalientes, Mexico: Aguascalientes International",10210
AGV,"Acarigua, Venezuela: Oswaldo Guevara Mujica",10211
AGX,"Agatti Island, India: Agatti Island Airport",10212
AHA,"Okinawa, Japan: Naha AB",10213
AHB,"Abha, Saudi Arabia: Abha Airport",10214
AHD,"Ardmore, OK: Ardmore Downtown Executive",10215
AHN,"Athens, GA: Athens/Ben Epps",10216
AHO,"Alghero/Sassari, Italy: Alghero",10217
AHS,"Ahuas, Honduras: Auas",10218
AHT,"Amchitka Island, AK: Amchitka",10219
AHU,"Al Hoceima, Morocco: Cherif El Idrissi International",10220
AIA,"Alliance, NE: Alliance Municipal",10221
AIB,"Anita Bay, AK: Anita Bay Airport",10222
AID,"Anderson, IN: Anderson Municipal-Darlington Field",10223
AIK,"Aiken, SC: Aiken Regional",10224
AIN,"Wainwright, AK: Wainwright Airport",10225
AIO,"Atlantic, IA: Atlantic Municipal",16849
AIT,"Aitutaki, Cook Islands: Aitutaki Airport",10226
AIY,"Atlantic City, NJ: Bader Field",10227
AIZ,"Lake of the Ozarks, MO: Lee C Fine Memorial",10228
AJA,"Ajaccio, France: Ajaccio Napoleon Bonaparte",10229
AJF,"Jouf, Saudi Arabia: Al Jouf",10230
AJJ,"Akjoujt, Mauritania: Akjoujt Airport",10231
AJL,"Aizwal, India: Lengpui",10232
AJN,"Anjouan, Comoros: Ouani",10233
AJR,"Arvidsjaur, Sweden: Arvidsjaur Airport",10234
AJU,"Aracaju, Brazil: Santa Maria International",10235
AJY,"Agades, Niger: Mano Dayak",10236
AK1,"Seward Peninsula, AK: Kelly Creek Airstrip",16489
AK2,"Bear Fish Camp, AK: Bear Fish Camp Airport",16490
AK3,"Fairbanks, AK: Gold King Creek",16505
AK4,"Squaw Lake, AK: Squaw Lake Airport",16508
AK5,"Qugruc, AK: Qugruc Airport",16580
AK6,"Gold King 2, AK: Gold King 2 Airport",16581
AK7,"Rampart, AK: Hunter Creek Mine",16584
AK8,"Zips, AK: Zips Airport",16621
AK9,"Tolstoi Bay, AK: Tolstoi Bay Airport",16630
AKB,"Atka, AK: Atka Airport",10237
AKC,"Akron, OH: Akron Fulton International",10238
AKF,"Kufrah, Libya: Kufra",10239
AKH,"Al Kharj, Saudi Arabia: Prince Sultan AB",15949
AKI,"Akiak, AK: Akiak Airport",10241
AKJ,"Asahikawa, Japan: Asahikawa Airport",10242
AKK,"Akhiok, AK: Akhiok Airport",10243
AKL,"Auckland, New Zealand: Auckland International",10244
AKN,"King Salmon, AK: King Salmon Airport",10245
AKO,"Akron, CO: Colorado Plains Regional",10246
AKP,"Anaktuvuk Pass, AK: Anaktuvuk Pass Airport",10247
AKR,"Akure, Nigeria: Akure Airport",10248
AKS,"Auki, Solomon Islands: Auki Airport",10249
AKT,"Akrotiri, Cyprus: Akrotiri Airport",10250
AKX,"Aktyubinsk, Kazakhstan: Aktyubinsk Airport",10251
AKY,"Sittwe, Burma: Sittwe Airport",10252
AL1,"Albertville, AL: Albertville Regional-Thomas J Brumlik Field",10253
AL2,"Alabaster, AL: Shelby County",10254
AL3,"Huntsville, AL: Huntsville Executive Tom Sharp Jr",10255
AL4,"Andalusia/Opp, AL: South Alabama Regional at Bill Benton Field",16423
AL5,"Demopolis, AL: Demopolis Regional",16455
AL6,"Fairhope, AL: H. L. Sonny Callahan",16497
AL7,"Jasper, AL: Walker County Bevill Field",16669
AL8,"Scottsboro, AL: Scottsboro Municipal Word Field",16737
AL9,"Sylacauga, AL: Merkel Field Sylacauga Municipal",16790
ALA,"Almaty, Kazakhstan: Almaty Airport",10256
ALB,"Albany, NY: Albany International",10257
ALC,"Alicante, Spain: Alicante Airport",10258
ALE,"Alpine, TX: Alpine Casparis Municipal",10259
ALF,"Alta, Norway: Alta Airport",10260
ALG,"Algiers, Algeria: Houari Boumediene",10261
ALH,"Albany, Australia: Albany Airport",10262
ALI,"Alice, TX: Alice International",10263
ALJ,"Alexander Bay, South Africa: Alexander Bay Airport",10264
ALK,"Asela, Ethiopia: Asela Airport",10265
ALL,"Liguria, Italy: Albenga",16889
ALM,"Alamogordo, NM: Alamogordo White Sands Regional",10266
ALN,"Alton, IL: St. Louis Regional",10267
ALO,"Waterloo, IA: Waterloo Regional",10268
ALP,"Aleppo, Syria: Aleppo International",10269
ALQ,"Alegrete, Brazil: Alegrete Airport",10270
ALR,"Alexandra, New Zealand: Alexandra Airport",10271
ALS,"Alamosa, CO: San Luis Valley Regional/Bergman Field",10272
ALT,"Alenquer, Brazil: Alenquer Airport",10273
ALU,"Alula, Somalia: Alula Airport",10274
ALW,"Walla Walla, WA: Walla Walla Regional",10275
ALX,"Alexander City, AL: Thomas C. Russell Field",10276
ALY,"Alexandria, Egypt: Alexandria International",10277
ALZ,"Lazy Bay, AK: Alitak Seaplane Base",10278
AMA,"Amarillo, TX: Rick Husband Amarillo International",10279
AMD,"Ahmedabad, India: Sardar Vallabh Bhai Patel International",10280
AMF,"Ama, Papua New Guinea: Ama Airport",10281
AMG,"Amboin, Papua New Guinea: Amboin Airport",10282
AMH,"Arba Minch, Ethiopia: Arba Minch Airport",10283
AMI,"Mataram, Indonesia: Selaparang",10284
AMK,"Durango, CO: Animas Air Park",10285
AML,"Puerto Armuelles, Panama: Puerto Armuelles Airport",10286
AMM,"Amman, Jordan: Queen Alia International",10287
AMN,"Alma, MI: Gratiot Community",10288
AMO,"Mao, Chad: Mao Airport",10289
AMP,"Ampanihy, Madagascar: Ampanihy Airport",10290
AMQ,"Ambon, Indonesia: Pattimura",10291
AMS,"Amsterdam, Netherlands: Schiphol",10292
AMW,"Ames, IA: Ames Municipal",10294
AMX,"Ammaroo, Australia: Ammaroo Station",10295
AMY,"Ambatomainty, Madagascar: Ambatomainty Airport",10296
ANA,"Anaheim, CA: Anaheim-Disneyland HP",10297
ANB,"Anniston, AL: Anniston Regional",10298
ANC,"Anchorage, AK: Ted Stevens Anchorage International",10299
AND,"Anderson, SC: Anderson Regional",10300
ANE,"Angers, France: Angers Marce",10301
ANF,"Antofagasta, Chile: Andres Sabella International",10302
ANG,"Angouleme, France: Angouleme Brie Champniers",10303
ANI,"Aniak, AK: Aniak Airport",10304
ANK,"Ankara, Turkey: Etimesgut",10305
ANM,"Antalaha, Madagascar: Antsirabato",10306
ANN,"Annette, AK: Annette Island",10307
ANO,"Angoche, Mozambique: Angoche Airport",10308
ANP,"Annapolis, MD: Lee",10309
ANR,"Antwerp, Belgium: Deurne",10310
ANS,"Andahuaylas, Peru: Andahuaylas Airport",10311
ANU,"St. Johns, Antigua and Barbuda: V C Bird International",10312
ANV,"Anvik, AK: Anvik Airport",10313
ANX,"Andeness, Norway: Andoya",10314
AOH,"Lima, OH: Lima Allen County",10317
AOI,"Ancona, Italy: Ancona Falconara",10318
AOJ,"Aomori, Japan: Aomori Airport",10319
AOK,"Karpathos, Greece: Karpathos Airport",10320
AOL,"Paso de Los Libres, Argentina: Paso de Los Libres Airport",10321
AOO,"Altoona, PA: Altoona-Blair County",10322
AOR,"Alor Setar, Malaysia: Sultan Abdul Halim",10323
AOS,"Amook Bay, AK: Amook Bay Airport",10324
APA,"Denver, CO: Centennial",10325
APB,"Apolo, Bolivia: Apolo Airport",10326
APC,"Napa, CA: Napa County",10327
APE,"San Juan Aposento, Peru: San Juan Aposento Airport",10328
APF,"Naples, FL: Naples Municipal",10329
APG,"Aberdeen, MD: Phillips AAF",10330
APH,"Fort A P Hill, VA: Mary Walker Lz",16767
API,"Villavicencio, Colombia: Capt Luis F Gomez Nino",15642
APK,"Apataki, French Polynesia: Apataki Airport",10331
APL,"Nampula, Mozambique: Nampula Airport",10332
APN,"Alpena, MI: Alpena County Regional",10333
APO,"Apartado, Colombia: Apartado Airport",10334
APR,"April River, Papua New Guinea: April River Airport",10335
APT,"Jasper, TN: Marion County Brown Field",10336
APV,"Apple Valley, CA: Apple Valley Airport",10337
APW,"Apia, Samoa: Faleolo International",10338
AQ1,"McMurdo Station, Antarctica: McMurdo Station Phoenix Field",16833
AQ2,"Terra Nova Bay, Antarctica: Mario Zucchelli",16834
AQI,"Qaisumah, Saudi Arabia: Al Qaisumah International",10339
AQJ,"Aqaba, Jordan: King Hussein International",10340
AQP,"Arequipa, Peru: Rodriguez Ballon International",10342
AQS,"Saqani, Fiji: Saqani Airport",10343
AQY,"Girdwood, AK: Girdwood Airport",10344
AR1,"Russellville, AR: Russellville Regional",10345
AR2,"Conway, AR: Dennis F Cantrell Field",10346
AR3,"Bentonville, AR: Bentonville Municipal Louise M Thaden Field",16738
AR4,"Colt, AR: Delta Regional",16886
ARA,"New Iberia, LA: Acadiana Regional",10347
ARB,"Ann Arbor, MI: Ann Arbor Municipal",10348
ARC,"Arctic Village, AK: Arctic Village Airport",10349
ARD,"Alor, Indonesia: Arcadia Municipal",10350
ARE,"Arecibo, PR: Antonio/Nery/Juarbe Pol",10351
ARG,"Walnut Ridge, AR: Walnut Ridge Regional",10352
ARH,"Arkhangelsk, Russia: Talagi",10353
ARI,"Arica, Chile: Chacalluta",10354
ARK,"Arusha, Tanzania: Arusha Airport",10355
ARM,"Armidale, Australia: Armidale Airport",10356
ARN,"Stockholm, Sweden: Arlanda",10357
ARP,"Aragip, Papua New Guinea: Aragip Airport",10358
ARQ,"Arauquita, Colombia: Arauquita Airport",10359
ARS,"Aragarcas, Brazil: Aragarcas Airport",10360
ART,"Watertown, NY: Watertown International",10361
ARU,"Aracatuba, Brazil: Aracatuba Airport",10362
ARV,"Minocqua/Woodruff, WI: Lakeland/Noble F. Lee Memorial Field",10363
ARW,"Arad, Romania: Arad International",10364
ARX,"Asbury Park, NJ: Asbury Park/Monmouth County",10365
ARY,"Ararat, Australia: Ararat Airport",10366
ARZ,"N'zeto, Angola: N'zeto Airport",10367
ASA,"Assab, Eritrea: Assab International",10368
ASB,"Ashgabat, Turkmenistan: Ashgabat Airport",10369
ASC,"Ascension, Bolivia: Ascension Airport",10370
ASD,"Andros Town, The Bahamas: Andros Town International",10371
ASE,"Aspen, CO: Aspen Pitkin County Sardy Field",10372
ASF,"Astrakhan, Russia: Narimanova",16674
ASG,"Ashburton, New Zealand: Ashburton Airport",10373
ASH,"Nashua, NH: Boire Field",10374
ASI,"Ascension Island, Saint Helena, Ascension, and Tristan da Cunha: Ascension Aux Af",10375
ASJ,"Amami O Shima, Japan: Amami",10376
ASK,"Yamoussoukro, Cote d'Ivoire: Yamoussoukro Airport",10377
ASL,"Marshall, TX: Harrison County",10378
ASM,"Asmara, Eritrea: Asmara International",10379
ASN,"Talladega, AL: Talladega Municipal",10380
ASO,"Asosa, Ethiopia: Asosa Hidase",10381
ASP,"Alice Springs, Australia: Alice Springs Airport",10382
ASQ,"Austin, NV: Austin Airport",10383
ASR,"Kayseri, Turkey: Kayseri Airport",10384
AST,"Astoria/Seaside, OR: Astoria Regional",10385
ASU,"Asuncion, Paraguay: Silvio Pettirossi International",10386
ASW,"Aswan, Egypt: Aswan International",10387
ASX,"Ashland, WI: John F Kennedy Memorial",10388
ASY,"Ashley, ND: Ashley Municipal",10389
ATA,"Anta, Peru: Anta Huaraz",10390
ATB,"Atbara, Sudan: Atbara Airport",10391
ATC,"Arthur's Town, The Bahamas: Arthur's Town Airport",10392
ATE,"Antlers, OK: Antlers Municipal",10393
ATH,"Athens, Greece: Eleftherios Venizelos International",10394
ATI,"Artigas, Uruguay: Artigas International",10395
ATK,"Atqasuk, AK: Atqasuk Edward Burnell Sr. Memorial",10396
ATL,"Atlanta, GA: Hartsfield-Jackson Atlanta International",10397
ATM,"Altamira, Brazil: Altamira Airport",10398
ATN,"Namatanai, Papua New Guinea: Namatanai Airport",10399
ATO,"Athens, OH: Ohio University",10400
ATP,"Aitape, Papua New Guinea: Aitape Airport",10401
ATQ,"Amritsar, India: Amritsar International",10402
ATR,"Atar, Mauritania: Atar Airport",10403
ATS,"Artesia, NM: Artesia Municipal",10404
ATT,"Atmautluak, AK: Atmautluak Airport",10405
ATU,"Attu, AK: Casco Cove CGS",10406
ATV,"Ati, Chad: Ati Airport",10407
ATW,"Appleton, WI: Appleton International",10408
ATY,"Watertown, SD: Watertown Regional",10409
ATZ,"Assiut, Egypt: Assiut Airport",10410
AU1,"Weipa, Australia: Scherger",16465
AUA,"Aruba, Aruba: Reina Beatrix International",10411
AUC,"Arauca, Colombia: Santiago Perez",10412
AUD,"Augustus Downs, Australia: Augustus Downs Airport",10413
AUG,"Augusta/Waterville, ME: Augusta State",10414
AUH,"Abu Dhabi, United Arab Emirates: Abu Dhabi International",10415
AUI,"Aua Island, Papua New Guinea: Aua Island Airport",16386
AUK,"Alakanuk, AK: Alakanuk Airport",10416
AUM,"Austin/Albert Lea, MN: Austin Municipal",10417
AUN,"Auburn, CA: Auburn Municipal",10418
AUO,"Auburn, AL: Auburn University Regional",10419
AUP,"Aguan, Papua New Guinea: Aguan Papua N.G.",10420
AUQ,"Atuona, French Polynesia: Hiva Oa/Atuona",10421
AUR,"Aurillac, France: Aurillac Airport",10422
AUS,"Austin, TX: Austin - Bergstrom International",10423
BSM,"Austin, TX: Austin - Bergstrom International",10423
AUW,"Wausau, WI: Wausau Downtown",10424
AUX,"Araguaina, Brazil: Araguaina Airport",10425
AUY,"Aneityum, Vanuatu: Aneityum Airport",10426
AUZ,"Aurora, IL: Aurora Municipal",10427
AVB,"Aviano, Italy: Aviano AB",10428
AVI,"Ciego de Avila, Cuba: Maximo Gomez",10430
AVL,"Asheville, NC: Asheville Regional",10431
AVN,"Avignon, France: Avignon Caumont",10432
AVO,"Avon Park, FL: Avon Park Executive",10433
AVP,"Scranton/Wilkes-Barre, PA: Wilkes Barre Scranton International",10434
AVV,"Avalon, Australia: Avalon Airport",10435
AVW,"Tucson, AZ: Marana Regional",10436
AVX,"Avalon, CA: Catalina",10437
AVX,"Avalon, CA: Catalina",11001
CIB,"Avalon, CA: Catalina",10437
CIB,"Avalon, CA: Catalina",11001
AWA,"Awasa, Ethiopia: Lake Awasa",10438
AWK,"Wake Island, TT: Wake Island Airfield",10439
AWM,"West Memphis, AR: West Memphis Municipal",10440
AWR,"Awar, Papua New Guinea: Awar Airport",10441
